<?xml version="1.0" encoding="ISO-8859-1"?>
<BD xmlns:xsi="http://www.w3.org/2001/XMLSchema-instance"
	  xsi:noNamespaceSchemaLocation="dvd.xsd">
<DVD id="dvd0" cb="_5414474401006" iddis="dis0"/>
<DVD id="dvd1" cb="_5414474401006" iddis="dis1"/>
<DVD id="dvd2" cb="_3259119658825" iddis="dis0"/>
<DVD id="dvd3" cb="_5414474401006" iddis="dis1"/>
<DVD id="dvd4" cb="_1234567891234" iddis="dis0"/>
<DVD id="dvd5" cb="_5414474401006" iddis="dis0"/>
<DVD id="dvd6" cb="_1234567891234" iddis="dis1"/>
<DVD id="dvd7" cb="_5414474401006" iddis="dis0"/>
<DVD id="dvd8" cb="_5414474401006" iddis="dis1"/>
<DVD id="dvd9" cb="_3259119658825" iddis="dis0"/>

<DVDdescr cb="_5414474401006" real="Tarantino" genre="Action" disponibilite="Y">Kill Bill</DVDdescr>
<DVDdescr cb="_3259119658825" real="Lynch" genre="Drame" disponibilite="Y">Mulholland Drive</DVDdescr>
<DVDdescr cb="_1234567891234" real="Dellanoy" genre="Comedie"  disponibilite="N">Le lit a deux place</DVDdescr>

<Distrib id="dis0">
  <Adresse>
    <Num>3</Num>
    <Rue>Rue de Paris</Rue>
    <Ville>Orsay</Ville>
    <CP>91400</CP>
  </Adresse>
</Distrib>

<Distrib id="dis1">
  <Adresse>
    <Num>38</Num>
    <Rue>Boulevard Dubreuil</Rue>
    <Ville>Orsay</Ville>
    <CP>91400</CP>
  </Adresse>
</Distrib>

</BD>
